"Guid","Description","DisplayUrl","ExternalId","Family","IsActive","Name","ProductCode","QuantityUnitOfMeasure","SBQQ__AssetAmendmentBehavior__c","SBQQ__AssetConversion__c","SBQQ__BatchQuantity__c","SBQQ__BillingFrequency__c","SBQQ__BillingType__c","SBQQ__BlockPricingField__c","SBQQ__ChargeType__c","SBQQ__Component__c","SBQQ__CompoundDiscountRate__c","SBQQ__ConfigurationEvent__c","SBQQ__ConfigurationFieldSet__c","SBQQ__ConfigurationFields__c","SBQQ__ConfigurationFormTitle__c","SBQQ__ConfigurationType__c","SBQQ__ConfigurationValidator__c","SBQQ__ConfiguredCodePattern__c","SBQQ__ConfiguredDescriptionPattern__c","SBQQ__CostEditable__c","SBQQ__CustomConfigurationPage__c","SBQQ__CustomConfigurationRequired__c","SBQQ__CustomerCommunityAvailability__c","SBQQ__DefaultPricingTable__c","SBQQ__DefaultQuantity__c","SBQQ__DescriptionLocked__c","SBQQ__DynamicPricingConstraint__c","SBQQ__EnableLargeConfiguration__c","SBQQ__ExcludeFromMaintenance__c","SBQQ__ExcludeFromOpportunity__c","SBQQ__ExternallyConfigurable__c","SBQQ__GenerateContractedPrice__c","SBQQ__HasConfigurationAttributes__c","SBQQ__HasConsumptionSchedule__c","SBQQ__Hidden__c","SBQQ__HidePriceInSearchResults__c","SBQQ__IncludeInMaintenance__c","SBQQ__NewQuoteGroup__c","SBQQ__NonDiscountable__c","SBQQ__NonPartnerDiscountable__c","SBQQ__OptionLayout__c","SBQQ__OptionSelectionMethod__c","SBQQ__Optional__c","SBQQ__PriceEditable__c","SBQQ__PricingMethodEditable__c","SBQQ__PricingMethod__c","SBQQ__ProductPictureID__c","SBQQ__QuantityEditable__c","SBQQ__QuantityScale__c","SBQQ__ReconfigurationDisabled__c","SBQQ__SortOrder__c","SBQQ__Specifications__c","SBQQ__SubscriptionBase__c","SBQQ__SubscriptionCategory__c","SBQQ__SubscriptionPercent__c","SBQQ__SubscriptionPricing__c","SBQQ__SubscriptionTerm__c","SBQQ__SubscriptionType__c","SBQQ__TaxCode__c","SBQQ__Taxable__c","SBQQ__TermDiscountLevel__c","SBQQ__UpgradeRatio__c","StockKeepingUnit"
011f8bf3-902b-41fb-a8ce-95851495aa81,Flat Professional Service Rates for mixed-us.,"#N/A","#N/A",Services,true,Professional Service Hours,SRV-002,"#N/A",Default,One per quote line,"#N/A","#N/A","#N/A",Quantity,One-Time,false,"#N/A","#N/A","#N/A","#N/A","#N/A","#N/A","#N/A","#N/A","#N/A",false,"#N/A",false,"#N/A","#N/A",1.0,false,"#N/A",false,false,false,false,"#N/A",false,false,false,false,false,false,true,false,"#N/A",Click,false,false,false,List,"#N/A",true,"#N/A",false,"#N/A","#N/A",List,"#N/A","#N/A",Fixed Price,1.0,Renewable,"#N/A",false,"#N/A","#N/A","#N/A"
01ea1b03-8d2c-41f7-8a0b-890603236366,Project manager for Atomic Security Suite Deployments,"#N/A","#N/A",Services,true,Project Manager,SRVR-001,"#N/A",Default,"#N/A","#N/A","#N/A","#N/A",Quantity,One-Time,false,"#N/A","#N/A","#N/A","#N/A","#N/A","#N/A","#N/A","#N/A","#N/A",false,"#N/A",false,"#N/A","#N/A",1.0,false,"#N/A",false,false,false,false,"#N/A",false,false,false,false,false,false,false,false,"#N/A",Click,false,false,false,List,"#N/A",true,"#N/A",false,"#N/A","#N/A",List,"#N/A","#N/A","#N/A","#N/A",Renewable,"#N/A",false,"#N/A","#N/A","#N/A"
034f43ca-956f-47d4-8ee1-9ca4e9b7ea5e,"Rack PDU 5.7W, 208V, 3 phase CS8365 input C13 output - Basic Rack Power Distribution Unit allows users to distribute power outlets to rack-mount equipment.","#N/A","#N/A",Hardware,true,"Rack PDU 5.7W, 208V, C13 output",PDU-2029,"#N/A",Allow Refund,One per quote line,"#N/A","#N/A","#N/A",Quantity,One-Time,true,"#N/A","#N/A","#N/A","#N/A","#N/A",Disabled,"#N/A","#N/A","#N/A",false,"#N/A",false,"#N/A","#N/A",1.0,false,"#N/A",false,false,false,false,"#N/A",false,false,false,false,true,false,false,false,Tabs,Click,false,false,false,List,"#N/A",true,"#N/A",false,"#N/A","#N/A",List,Hardware,"#N/A","#N/A","#N/A",One-time,"#N/A",false,"#N/A","#N/A","#N/A"
040325d2-5b79-4b0a-bdd3-04352c2835b6,Management for Optimized Virtual Environments (MOVE) AntiVirus brings advanced virus protection to virtualized desktops and servers.,"#N/A","#N/A",Software,true,MOVE AntiVirus,SS-004,"#N/A",Default,One per quote line,"#N/A",Monthly,Arrears,Quantity,Recurring,false,"#N/A","#N/A","#N/A","#N/A","#N/A","#N/A","#N/A","#N/A","#N/A",false,"#N/A",false,"#N/A","#N/A",1.0,false,"#N/A",false,false,false,false,"#N/A",false,false,false,false,false,false,false,false,"#N/A",Click,false,false,false,List,"#N/A",true,"#N/A",false,"#N/A","#N/A",List,OnPremise,"#N/A",Fixed Price,1.0,"#N/A","#N/A",false,"#N/A","#N/A","#N/A"
049274a8-a27a-4ca9-817c-4cb927c08183,"Rack PDU 14.4kW, 208V, 3 phase CS8365 input C13 output - Basic Rack Power Distribution Unit allows users to distribute power outlets to rack-mount equipment.","#N/A","#N/A",Hardware,true,"Rack PDU 14.4kW, 208V, C13 output",PDU-2028,"#N/A",Allow Refund,One per quote line,"#N/A","#N/A","#N/A",Quantity,One-Time,true,"#N/A","#N/A","#N/A","#N/A","#N/A",Disabled,"#N/A","#N/A","#N/A",false,"#N/A",false,"#N/A","#N/A",1.0,false,"#N/A",false,false,false,false,"#N/A",false,false,false,false,true,false,false,false,Tabs,Click,false,false,false,List,"#N/A",true,"#N/A",false,"#N/A","#N/A",List,Hardware,"#N/A","#N/A","#N/A",One-time,"#N/A",false,"#N/A","#N/A","#N/A"
06a211f0-d6f1-4b39-9ccb-315794f9842a,"16GB RDIMM, 2133MT/s, Dual Rank, x4 Data Width","#N/A","#N/A",Hardware,true,"16GB RDIMM, 2133MT/s",MEM 16GB,"#N/A",Allow Refund,One per quote line,"#N/A","#N/A","#N/A",Quantity,One-Time,true,"#N/A","#N/A","#N/A","#N/A","#N/A",Disabled,"#N/A","#N/A","#N/A",false,"#N/A",false,"#N/A","#N/A",1.0,false,"#N/A",false,false,false,false,Do Not Generate,false,false,false,false,true,false,false,false,Tabs,Click,false,false,false,List,"#N/A",true,"#N/A",false,"#N/A","#N/A",List,Hardware,"#N/A","#N/A","#N/A",One-time,"#N/A",false,"#N/A","#N/A","#N/A"
06e2826c-602d-4a0e-804e-5013bb015e17,Full control over User Experience for SSO Suite.,"#N/A","#N/A",Software,true,Customizable User Experience,S-SSO-UX,"#N/A",Default,One per quote line,"#N/A",Annual,Advance,Quantity,Recurring,false,"#N/A","#N/A","#N/A","#N/A","#N/A","#N/A","#N/A","#N/A","#N/A",false,"#N/A",false,"#N/A","#N/A",1.0,false,"#N/A",false,false,false,false,"#N/A",false,false,false,false,false,false,false,false,"#N/A",Click,false,false,false,List,"#N/A",true,"#N/A",false,"#N/A","#N/A",List,"#N/A","#N/A",Fixed Price,12.0,Renewable,"#N/A",false,"#N/A","#N/A","#N/A"
070795b4-f624-4107-a9a6-745589ad7ca5,Universal Data Collection / Indexing combines high-end data collection with consumption based indexing and cloud machine learning analyzing real-time network data.,"#N/A","#N/A",Software,true,Universal Data Collection / Indexing,DC-008,"#N/A",Default,One per quote line,"#N/A",Monthly,Arrears,Quantity,Recurring,false,"#N/A","#N/A","#N/A","#N/A","#N/A","#N/A","#N/A","#N/A","#N/A",false,"#N/A",false,"#N/A","#N/A",1.0,false,"#N/A",false,false,false,false,"#N/A",false,true,false,false,false,false,true,false,"#N/A",Click,false,false,false,List,"#N/A",true,"#N/A",false,"#N/A","#N/A",List,"#N/A","#N/A",Fixed Price,1.0,Renewable,"#N/A",false,"#N/A","#N/A","#N/A"
07597caa-acef-4838-8cab-24ad3b1becae,"Database Event Monitor for SIEM provides a complete audit trail of all database activities, including queries, results, authentication activity, and privilege escalations.","#N/A","#N/A",Software,true,Database Event Monitor,SIEM-003,"#N/A",Default,One per quote line,"#N/A",Monthly,Arrears,Quantity,Recurring,false,"#N/A","#N/A","#N/A","#N/A","#N/A","#N/A","#N/A","#N/A","#N/A",false,"#N/A",false,"#N/A","#N/A",1.0,false,"#N/A",false,false,false,false,"#N/A",false,false,false,false,false,false,false,false,"#N/A",Click,false,false,false,List,"#N/A",true,"#N/A",false,"#N/A","#N/A",List,"#N/A","#N/A",Fixed Price,12.0,Renewable,"#N/A",false,"#N/A","#N/A","#N/A"
08a9c0d3-eb99-441d-b0a4-498663dd082f,"System maintenance, administration, and configuration performed by a certified technician. 15% of hardware.","#N/A","#N/A",Services,true,Silver Hardware Maintenance,SUPP-1000,"#N/A",Default,One per quote line,"#N/A",Annual,Advance,Quantity,Recurring,true,"#N/A","#N/A","#N/A","#N/A","#N/A",Disabled,"#N/A","#N/A","#N/A",false,"#N/A",false,"#N/A",Standard,1.0,false,"#N/A",false,true,false,false,Do Not Generate,false,false,false,false,false,false,true,false,Tabs,Click,false,false,false,List,"#N/A",true,"#N/A",false,"#N/A","#N/A",Net,Hardware,15.0,Percent Of Total,12.0,Renewable,"#N/A",false,Line,"#N/A","#N/A"
09ce26ad-f4cc-4eb8-a332-0e20991c25f7,"Using an intuitive color-coded rating system, SiteAdvisor Enterprise identifies websites that contain malware or other threats such as spyware or phishing scams, alerting you before you click.","#N/A","#N/A",Software,true,SiteAdvisor Enterprise,EP-012,"#N/A",Default,One per quote line,"#N/A",Monthly,Arrears,Quantity,Recurring,false,"#N/A","#N/A","#N/A","#N/A","#N/A","#N/A","#N/A","#N/A","#N/A",false,"#N/A",false,"#N/A","#N/A",1.0,false,"#N/A",false,false,false,false,"#N/A",false,false,false,false,false,false,false,false,"#N/A",Click,false,false,false,List,"#N/A",true,"#N/A",false,"#N/A","#N/A",List,"#N/A","#N/A",Fixed Price,1.0,Renewable,"#N/A",false,"#N/A","#N/A","#N/A"
0b0763cf-8beb-4114-bc76-51756505a377,"8TB 7.2k RPM Self-Encrypting NLSAS 12Gps 3.5 in - Performing like any other hard drive, with the encryption being completely transparent or invisible to the user.","#N/A","#N/A",Hardware,true,8TB 7.2k RPM Self-Encrypting NLSAS,HD 8TBSE,"#N/A",Allow Refund,One per quote line,"#N/A","#N/A","#N/A",Quantity,One-Time,true,"#N/A","#N/A","#N/A","#N/A","#N/A",Disabled,"#N/A","#N/A","#N/A",false,"#N/A",false,"#N/A","#N/A",1.0,false,"#N/A",false,false,false,false,Do Not Generate,false,false,false,false,true,false,false,false,Tabs,Click,false,false,false,List,"#N/A",true,"#N/A",false,"#N/A","#N/A",List,Hardware,"#N/A","#N/A","#N/A",One-time,"#N/A",false,"#N/A","#N/A","#N/A"
0cfa2277-bb43-4975-bc41-0bdccd459733,"#N/A","#N/A","#N/A",Software,true,Network Penetration Tests,SM-005,"#N/A",Default,One per quote line,"#N/A",Monthly,"#N/A",Quantity,Usage,false,"#N/A","#N/A","#N/A","#N/A","#N/A","#N/A","#N/A","#N/A","#N/A",false,"#N/A",false,"#N/A","#N/A",1.0,false,"#N/A",false,false,false,false,"#N/A",false,false,false,false,false,false,true,false,"#N/A",Click,false,false,false,List,"#N/A",true,"#N/A",false,"#N/A","#N/A","#N/A","#N/A","#N/A",Fixed Price,12.0,Renewable,"#N/A",false,"#N/A","#N/A","#N/A"
0f615764-03bb-4b08-b36a-b63f2533a1bb,Online Admin Training for the Single Sign On Suite,"#N/A","#N/A",Services,true,SSO Admin Training,S-SSO-ADTR,"#N/A",Default,One per quote line,"#N/A","#N/A","#N/A",Quantity,One-Time,false,"#N/A","#N/A","#N/A","#N/A","#N/A","#N/A","#N/A","#N/A","#N/A",false,"#N/A",false,"#N/A","#N/A",1.0,false,"#N/A",false,false,false,false,"#N/A",false,false,false,false,false,false,false,false,"#N/A",Click,false,false,false,List,"#N/A",true,"#N/A",false,"#N/A","#N/A",List,"#N/A","#N/A","#N/A","#N/A",Renewable,"#N/A",false,"#N/A","#N/A","#N/A"
0fe2d144-2994-41cf-9012-2484e6a129d2,"Event Receiver collects and retains large amounts of security data, and gives you immediate access to that data.","#N/A","#N/A",Software,true,Event Receiver,SIEM-006,"#N/A",Default,One per quote line,"#N/A",Monthly,Arrears,Quantity,Recurring,false,"#N/A","#N/A","#N/A","#N/A","#N/A","#N/A","#N/A","#N/A","#N/A",false,"#N/A",false,"#N/A","#N/A",1.0,false,"#N/A",false,false,false,false,"#N/A",false,false,false,false,false,false,false,false,"#N/A",Click,false,false,false,List,"#N/A",true,"#N/A",false,"#N/A","#N/A",List,"#N/A","#N/A",Fixed Price,12.0,Renewable,"#N/A",false,"#N/A","#N/A","#N/A"
1245dd7d-1dc1-4b0a-a500-4fd8d75c9abb,"Security for Microsoft SharePoint ensures that your corporate SharePoint deployment does not spread malware, store inappropriate content, or lead to data loss.","#N/A","#N/A",Software,true,Security for Microsoft SharePoint,EP-011,"#N/A",Default,One per quote line,"#N/A",Monthly,Arrears,Quantity,Recurring,false,"#N/A","#N/A","#N/A","#N/A","#N/A","#N/A","#N/A","#N/A","#N/A",false,"#N/A",false,"#N/A","#N/A",1.0,false,"#N/A",false,false,false,false,"#N/A",false,false,false,false,false,false,false,false,"#N/A",Click,false,false,false,List,"#N/A",true,"#N/A",false,"#N/A","#N/A",List,"#N/A","#N/A",Fixed Price,1.0,Renewable,"#N/A",false,"#N/A","#N/A","#N/A"
144b77dd-2750-49de-be66-da3a4abbad33,"Intel Xeon E5-2667 v4 3.2GHz,25M Cache,9.60GT/s 8C/16T (135W) - Designed for software defined infrastructure supercharged for efficiency, performance, and agile services delivery across cloud-native and traditional applications.","#N/A","#N/A",Hardware,true,Intel Xeon E5-2667 v4 3.2GHz,INTEL E5-2667,"#N/A",Allow Refund,One per quote line,"#N/A","#N/A","#N/A",Quantity,One-Time,true,"#N/A","#N/A","#N/A","#N/A","#N/A",Disabled,"#N/A","#N/A","#N/A",false,"#N/A",false,"#N/A","#N/A",1.0,false,"#N/A",false,false,false,false,Do Not Generate,false,false,false,false,true,false,false,false,Tabs,Click,false,false,false,List,"#N/A",true,"#N/A",false,"#N/A","#N/A",List,Hardware,"#N/A","#N/A","#N/A",One-time,"#N/A",false,"#N/A","#N/A","#N/A"
14f4cbfe-5531-4258-9e18-4d341b484dc4,Windows Server 2012 R2 brings our experience delivering global-scale cloud services into your infrastructure,"#N/A","#N/A",Software,true,Windows Server R2 2012,WIN S2012,"#N/A",Allow Refund,One per quote line,"#N/A","#N/A","#N/A",Quantity,One-Time,true,"#N/A","#N/A","#N/A","#N/A","#N/A",Disabled,"#N/A","#N/A","#N/A",false,"#N/A",false,"#N/A","#N/A",1.0,false,"#N/A",false,false,false,false,"#N/A",false,false,false,false,true,false,false,false,Tabs,Click,false,false,false,List,"#N/A",true,"#N/A",false,"#N/A","#N/A",List,Software,"#N/A","#N/A","#N/A",Renewable,"#N/A",false,"#N/A","#N/A","#N/A"
157c835e-d0f5-4ea0-b659-c20b4d821832,"Web Gateway Cloud Service eliminates the constraints of on-network web security by connecting users from any device or location to the internet through our cloud, maintaining protection wherever they go.","#N/A","#N/A",Software,true,Web Gateway Cloud Service,WS-002,"#N/A",Default,One per quote line,"#N/A",Monthly,Arrears,Quantity,Recurring,false,"#N/A","#N/A","#N/A","#N/A","#N/A","#N/A","#N/A","#N/A","#N/A",false,"#N/A",false,"#N/A","#N/A",1.0,false,"#N/A",false,false,false,false,"#N/A",false,false,false,false,false,false,false,false,"#N/A",Click,false,false,false,List,"#N/A",true,"#N/A",false,"#N/A","#N/A",List,"#N/A","#N/A",Fixed Price,1.0,Renewable,"#N/A",false,"#N/A","#N/A","#N/A"
15e0975f-63dd-4f70-b7f8-5fddaceb9d31,"Intel Xeon E5-2698 v4 2.2GHz,50M Cache,9.60GT/s 20C/40T (135W) - Designed for software defined infrastructure supercharged for efficiency, performance, and agile services delivery across cloud-native and traditional applications.","#N/A","#N/A",Hardware,true,Intel Xeon E5-2698 v4 2.2GHz,INTEL E5-2698,"#N/A",Allow Refund,One per quote line,"#N/A","#N/A","#N/A",Quantity,One-Time,true,"#N/A","#N/A","#N/A","#N/A","#N/A",Disabled,"#N/A","#N/A","#N/A",false,"#N/A",false,"#N/A","#N/A",1.0,false,"#N/A",false,false,false,false,Do Not Generate,false,false,false,false,true,false,false,false,Tabs,Click,false,false,false,List,"#N/A",true,"#N/A",false,"#N/A","#N/A",List,Hardware,"#N/A","#N/A","#N/A",One-time,"#N/A",false,"#N/A","#N/A","#N/A"
1642e20d-9e0d-4f06-a88e-257f7b7d3fd9,Quality Assurance Engineers test and support the activities prior to a successful Go-Live launch.,"#N/A","#N/A",Services,true,Quality Assurance Engineer,SV-QAE,"#N/A",Default,One per quote line,"#N/A","#N/A","#N/A",Quantity,One-Time,false,"#N/A","#N/A","#N/A","#N/A","#N/A","#N/A","#N/A","#N/A","#N/A",false,"#N/A",false,"#N/A","#N/A",1.0,false,"#N/A",false,false,false,false,"#N/A",false,false,false,false,false,false,true,false,"#N/A",Click,false,false,false,List,"#N/A",true,"#N/A",false,"#N/A","#N/A",List,"#N/A","#N/A","#N/A","#N/A",Renewable,"#N/A",false,"#N/A","#N/A","#N/A"
18da4344-2624-4c1a-9f69-28aec9e847fb,"Support and protect your IT equipment with rack enclosures designed for flexible deployments, usability and infrastructure scalability.","#N/A","#N/A",Hardware,true,Maxspace Rack Enclosure,MAXS-1014,"#N/A",Allow Refund,One per quote line,"#N/A","#N/A","#N/A",Quantity,One-Time,false,"#N/A",Always,"#N/A","#N/A","#N/A",Required,"#N/A","#N/A","#N/A",false,"#N/A",false,"#N/A","#N/A",1.0,false,"#N/A",false,false,false,false,"#N/A",false,false,false,true,true,false,false,false,Tabs,Click,false,false,false,List,"#N/A",true,"#N/A",false,"#N/A","#N/A",List,Hardware,"#N/A","#N/A","#N/A",One-time,"#N/A",false,"#N/A","#N/A","#N/A"
1c0d4d0c-6d24-4e0d-843f-799c979ffc3f,Currency Conversion Credit,"#N/A","#N/A","#N/A",true,Currency Conversion Credit,curr-credit,"#N/A",Default,One per quote line,"#N/A","#N/A","#N/A",Quantity,One-Time,true,"#N/A","#N/A","#N/A","#N/A","#N/A","#N/A","#N/A","#N/A","#N/A",false,"#N/A",false,"#N/A","#N/A",1.0,false,"#N/A",false,false,false,false,"#N/A",false,false,false,false,false,false,false,false,"#N/A",Click,false,true,false,List,"#N/A",true,"#N/A",false,"#N/A","#N/A",List,"#N/A","#N/A","#N/A","#N/A",Renewable,"#N/A",false,"#N/A","#N/A","#N/A"
2165a788-bf9d-489a-9e89-0e384b1c7909,Threat Intelligence Exchange Report Tools allows for audit extraction into data warehouse formats for offline analysis.,"#N/A","#N/A",Software,true,Threat Intelligence Reporting Tools,SM-004,"#N/A",Default,One per quote line,"#N/A",Monthly,Arrears,Quantity,Recurring,false,"#N/A","#N/A","#N/A","#N/A","#N/A","#N/A","#N/A","#N/A","#N/A",false,"#N/A",false,"#N/A","#N/A",1.0,false,"#N/A",false,false,false,false,"#N/A",false,false,false,false,false,false,false,false,"#N/A",Click,false,false,false,List,"#N/A",false,"#N/A",false,"#N/A","#N/A",List,"#N/A","#N/A",Fixed Price,12.0,Renewable,"#N/A",false,"#N/A","#N/A","#N/A"
24a3027a-f3a8-4dc2-9462-a571c7fc40f6,"MaxShell cooling, power distribution, and cable management products work seamlessly with IT enclosures to provide a complete infrastructure support system.  Holds 10 rack units (U's) for a vertical storage rack.","#N/A","#N/A",Hardware,true,MaxShell 10U 600mmx1200mm,BMX-1053,"#N/A",Allow Refund,One per quote line,"#N/A","#N/A","#N/A",Quantity,One-Time,true,"#N/A","#N/A","#N/A","#N/A","#N/A",Disabled,"#N/A","#N/A","#N/A",false,"#N/A",false,"#N/A","#N/A",1.0,false,"#N/A",false,false,false,false,"#N/A",false,false,false,false,true,false,false,false,Tabs,Click,false,false,false,List,"#N/A",true,"#N/A",false,"#N/A","#N/A",List,Hardware,"#N/A","#N/A","#N/A",One-time,"#N/A",false,"#N/A","#N/A","#N/A"
26ee4dab-f5a7-41e8-a01a-d421d3bcfac3,"Advanced Correlation Engine with Enterprise Security Manager to identify and score threat events in real time, using both rule- and risk-based logic.","#N/A","#N/A",Software,true,Advanced Correlation Engine,SIEM-001,"#N/A",Default,One per quote line,"#N/A",Monthly,Arrears,Quantity,Recurring,false,"#N/A","#N/A","#N/A","#N/A","#N/A","#N/A","#N/A","#N/A","#N/A",false,"#N/A",false,"#N/A","#N/A",1.0,false,"#N/A",false,false,false,false,"#N/A",false,false,false,false,false,false,false,false,"#N/A",Click,false,false,false,List,"#N/A",true,"#N/A",false,"#N/A","#N/A",List,"#N/A","#N/A",Fixed Price,12.0,Renewable,"#N/A",false,"#N/A","#N/A","#N/A"
289808a9-42d8-4b0b-9346-2efe8d11939e,"vSphere Enterprise includes the full range of vSphere features for transforming datacenters into dramatically simplified cloud computing environments providing the next generation of flexible, reliable IT services.","#N/A","#N/A",Software,true,vSphere Enterprise,VMW-E,"#N/A",Allow Refund,One per quote line,"#N/A","#N/A","#N/A",Quantity,One-Time,true,"#N/A","#N/A","#N/A","#N/A","#N/A",Disabled,"#N/A","#N/A","#N/A",false,"#N/A",false,"#N/A","#N/A",1.0,false,"#N/A",false,false,false,false,"#N/A",false,false,false,false,true,false,false,false,Tabs,Click,false,false,false,List,"#N/A",true,"#N/A",false,"#N/A","#N/A",List,Software,"#N/A",Fixed Price,1.0,Renewable,"#N/A",false,"#N/A","#N/A","#N/A"
2be1185c-6b26-4b58-a68f-d1b14485a4ce,The Power Cord is designed to provide ideal electrical connectivity to your equipments. It operates at 250-Volt voltage range.,"#N/A","#N/A",Hardware,true,C19 to C20 Power Cable 3',CMPC-5889,"#N/A",Allow Refund,One per quote line,"#N/A","#N/A","#N/A",Quantity,One-Time,true,"#N/A","#N/A","#N/A","#N/A","#N/A",Disabled,"#N/A","#N/A","#N/A",false,"#N/A",false,"#N/A","#N/A",1.0,false,"#N/A",false,false,false,false,"#N/A",false,false,false,false,true,false,false,false,Tabs,Click,false,false,false,List,"#N/A",true,"#N/A",false,"#N/A","#N/A",List,Hardware,"#N/A","#N/A","#N/A",One-time,"#N/A",false,"#N/A","#N/A","#N/A"
2f2e0f32-ef4a-44e7-b115-7781433344e3,"Web Protection uses secure web gateway technology to protect every device, user, and location from sophisticated internet threats.","#N/A","#N/A",Software,true,Web Protection,WS-003,"#N/A",Default,One per quote line,"#N/A",Monthly,Arrears,Quantity,Recurring,false,"#N/A","#N/A","#N/A","#N/A","#N/A","#N/A","#N/A","#N/A","#N/A",false,"#N/A",false,"#N/A","#N/A",1.0,false,"#N/A",false,false,false,false,"#N/A",false,false,false,false,false,false,false,false,"#N/A",Click,false,false,false,List,"#N/A",true,"#N/A",false,"#N/A","#N/A",List,"#N/A","#N/A",Fixed Price,1.0,Renewable,"#N/A",false,"#N/A","#N/A","#N/A"
30c052d0-d834-40f6-9cb6-4d32731f14ff,"32GB RDIMM, 2133 MT/s, Low Volt, Dual Rank, x4 Data Width","#N/A","#N/A",Hardware,true,"32GB RDIMM, 2133MT/s",MEM 32GB,"#N/A",Allow Refund,One per quote line,"#N/A","#N/A","#N/A",Quantity,One-Time,true,"#N/A","#N/A","#N/A","#N/A","#N/A",Disabled,"#N/A","#N/A","#N/A",false,"#N/A",false,"#N/A","#N/A",1.0,false,"#N/A",false,false,false,false,Do Not Generate,false,false,false,false,true,false,false,false,Tabs,Click,false,false,false,List,"#N/A",true,"#N/A",false,"#N/A","#N/A",List,Hardware,"#N/A","#N/A","#N/A",One-time,"#N/A",false,"#N/A","#N/A","#N/A"
3302e35d-8855-43d6-b3a2-e1ce167b207e,Application Protection for an unlimited number of applications.,"#N/A","#N/A",Software,true,Application Protection Unlimited,S-SSO-APU,"#N/A",Default,One per quote line,"#N/A",Annual,Advance,Quantity,Recurring,false,"#N/A","#N/A","#N/A","#N/A","#N/A","#N/A","#N/A","#N/A","#N/A",false,"#N/A",false,"#N/A","#N/A",1.0,false,"#N/A",false,false,false,false,"#N/A",false,false,false,false,false,false,true,false,"#N/A",Click,false,false,false,List,"#N/A",true,"#N/A",false,"#N/A","#N/A",List,"#N/A","#N/A",Fixed Price,12.0,Renewable,"#N/A",false,"#N/A","#N/A","#N/A"
330cd837-e2ab-4498-9b2f-90d3c73e16f0,vSphere Standard provides an entry solution for basic consolidation of applications to slash hardware costs while accelerating application deployment.,"#N/A","#N/A",Software,true,vSphere Standard,VMW-S,"#N/A",Allow Refund,One per quote line,"#N/A","#N/A","#N/A",Quantity,One-Time,true,"#N/A","#N/A","#N/A","#N/A","#N/A",Disabled,"#N/A","#N/A","#N/A",false,"#N/A",false,"#N/A","#N/A",1.0,false,"#N/A",false,false,false,false,"#N/A",false,false,false,false,true,false,false,false,Tabs,Click,false,false,false,List,"#N/A",true,"#N/A",false,"#N/A","#N/A",List,Software,"#N/A",Fixed Price,1.0,Renewable,"#N/A",false,"#N/A","#N/A","#N/A"
335b8bda-f99d-4c3c-bc03-0d4f2e23f25e,"Virtual Network Security Platform delivers a complete network security solution ready for the unique demands of private, public, and hybrid clouds.","#N/A","#N/A",Software,true,Virtual Network Security Platform,NS-003,"#N/A",Default,One per quote line,"#N/A",Monthly,Arrears,Quantity,Recurring,false,"#N/A","#N/A","#N/A","#N/A","#N/A","#N/A","#N/A","#N/A","#N/A",false,"#N/A",false,"#N/A","#N/A",1.0,false,"#N/A",false,false,false,false,"#N/A",false,false,false,false,false,false,false,false,"#N/A",Click,false,false,false,List,"#N/A",true,"#N/A",false,"#N/A","#N/A",List,"#N/A","#N/A",Fixed Price,1.0,Renewable,"#N/A",false,"#N/A","#N/A","#N/A"
33ea4e8c-507f-4338-a781-3b3c348be1c1,"The Project Manager ensures a projects timely and efficient delivery by coordinating meetings, tracking progress, escalating issues, and proctoring weekly status reports.","#N/A","#N/A",Services,true,Project Manager,SV-PMN,"#N/A",Default,One per quote line,"#N/A","#N/A","#N/A",Quantity,One-Time,false,"#N/A","#N/A","#N/A","#N/A","#N/A","#N/A","#N/A","#N/A","#N/A",false,"#N/A",false,"#N/A","#N/A",1.0,false,"#N/A",false,false,false,false,"#N/A",false,false,false,false,false,false,true,false,"#N/A",Click,false,false,false,List,"#N/A",true,"#N/A",false,"#N/A","#N/A",List,"#N/A","#N/A","#N/A","#N/A",Renewable,"#N/A",false,"#N/A","#N/A","#N/A"
34a5c7aa-c2b9-4c30-8bca-5e140d3882b7,Our certified Implementation Engineers bring a wealth of application expertise and integration experience to ensure the client's other systems are connected.,"#N/A","#N/A",Services,true,Implementation Engineer,SV-IMP,"#N/A",Default,One per quote line,"#N/A","#N/A","#N/A",Quantity,One-Time,true,"#N/A","#N/A","#N/A","#N/A","#N/A","#N/A","#N/A","#N/A","#N/A",false,"#N/A",false,"#N/A","#N/A",1.0,false,"#N/A",false,false,false,false,"#N/A",false,false,false,false,false,false,false,false,"#N/A",Click,false,false,false,List,"#N/A",true,"#N/A",false,"#N/A","#N/A",List,"#N/A","#N/A","#N/A","#N/A",Renewable,"#N/A",false,"#N/A","#N/A","#N/A"
3770cb2d-5867-46ef-aecf-eb407af4774a,"Enterprise Log Manager collects, compresses, signs, and stores all original events with a clear audit trail of activity that can't be repudiated.","#N/A","#N/A",Software,true,Enterprise Log Manager,SIEM-004,"#N/A",Default,One per quote line,"#N/A",Monthly,Arrears,Quantity,Recurring,false,"#N/A","#N/A","#N/A","#N/A","#N/A","#N/A","#N/A","#N/A","#N/A",false,"#N/A",false,"#N/A","#N/A",1.0,false,"#N/A",false,false,false,false,"#N/A",false,false,false,false,false,false,false,false,"#N/A",Click,false,false,false,List,"#N/A",true,"#N/A",false,"#N/A","#N/A",List,"#N/A","#N/A",Fixed Price,1.0,Renewable,"#N/A",false,"#N/A","#N/A","#N/A"
