b400b55f-1708-461e-8ae0-e2d04deaf80a,Our certified Integration Specialist Engineers bring a wealth of application expertise and integration experience to ensure the client's other systems are connected.,"#N/A","#N/A",Services,true,Integration Specialist Engineer,SV-ISE,"#N/A",Default,One per quote line,"#N/A","#N/A","#N/A",Quantity,One-Time,true,"#N/A","#N/A","#N/A","#N/A","#N/A","#N/A","#N/A","#N/A","#N/A",false,"#N/A",false,"#N/A","#N/A",1.0,false,"#N/A",false,false,false,false,"#N/A",false,false,false,false,false,false,false,false,"#N/A",Click,false,false,false,List,"#N/A",true,"#N/A",false,"#N/A","#N/A",List,"#N/A","#N/A","#N/A","#N/A",Renewable,"#N/A",false,"#N/A","#N/A","#N/A"
b4f79b78-dfb4-484a-9d0e-d16408c1ce39,"Rack PDU 15A, 120V L5-20 input 5-20 output - Basic Rack Power Distribution Unit allows users to distribute power outlets to rack-mount equipment.","#N/A","#N/A",Hardware,true,"Rack PDU 15A, 120V L5-20",PDU-2024,"#N/A",Allow Refund,One per quote line,"#N/A","#N/A","#N/A",Quantity,One-Time,true,"#N/A","#N/A","#N/A","#N/A","#N/A",Disabled,"#N/A","#N/A","#N/A",false,"#N/A",false,"#N/A","#N/A",1.0,false,"#N/A",false,false,false,false,"#N/A",false,false,false,false,true,false,false,false,Tabs,Click,false,false,false,List,"#N/A",true,"#N/A",false,"#N/A","#N/A",List,Hardware,"#N/A","#N/A","#N/A",One-time,"#N/A",false,"#N/A","#N/A","#N/A"
b5eaae1e-3dc8-4ced-ba75-e24d396b0876,"Module that enables the export of your Single Sign On data to Access, Excel, and JDBC Databases.","#N/A","#N/A",Software,true,Report Exporting Tools,S-SSO-REPX,"#N/A",Default,One per quote line,"#N/A",Annual,Advance,Quantity,Recurring,false,"#N/A","#N/A","#N/A","#N/A","#N/A","#N/A","#N/A","#N/A","#N/A",false,"#N/A",false,"#N/A","#N/A",1.0,false,"#N/A",false,false,false,false,"#N/A",false,false,false,false,false,false,false,false,"#N/A",Click,false,false,false,List,"#N/A",true,"#N/A",false,"#N/A","#N/A",List,"#N/A","#N/A",Fixed Price,12.0,Renewable,"#N/A",false,"#N/A","#N/A","#N/A"
ba0cd251-71be-463f-b45a-850a14f42289,"MaxShell cooling, power distribution, and cable management products work seamlessly with IT enclosures to provide a complete infrastructure support system.  Holds 8 rack units (U's) for a vertical storage rack.","#N/A","#N/A",Hardware,true,MaxShell 8U 600mmx1070mm,BMX-1050,"#N/A",Allow Refund,One per quote line,"#N/A","#N/A","#N/A",Quantity,One-Time,true,"#N/A","#N/A","#N/A","#N/A","#N/A",Disabled,"#N/A","#N/A","#N/A",false,"#N/A",false,"#N/A","#N/A",1.0,false,"#N/A",false,false,false,false,"#N/A",false,false,false,false,true,false,false,false,Tabs,Click,false,false,false,List,"#N/A",true,"#N/A",false,"#N/A","#N/A",List,Hardware,"#N/A","#N/A","#N/A",One-time,"#N/A",false,"#N/A","#N/A","#N/A"
ba88d87d-7fbd-45d7-b58a-fea03c91bd3d,8TB 7.2k RPM NLSAS 12Gps 3.5 in - Industry-leading rotational vibration tolerance design helps ensure consistent performance in dense multi-drive systems,"#N/A","#N/A",Hardware,true,8TB 7.2k RPM NLSAS,HD 8TB,"#N/A",Allow Refund,One per quote line,"#N/A","#N/A","#N/A",Quantity,One-Time,true,"#N/A","#N/A","#N/A","#N/A","#N/A",Disabled,"#N/A","#N/A","#N/A",false,"#N/A",false,"#N/A","#N/A",1.0,false,"#N/A",false,false,false,false,Do Not Generate,false,false,false,false,true,false,false,false,Tabs,Click,false,false,false,List,"#N/A",true,"#N/A",false,"#N/A","#N/A",List,Hardware,"#N/A","#N/A","#N/A",One-time,"#N/A",false,"#N/A","#N/A","#N/A"
bf1e0d21-325b-4eee-9e04-ae8843d18405,Online Single Sign On training for end users includes education and certification modules. Annual Subscription.,"#N/A","#N/A",Services,true,SSO Training Portal for End Users,S-SSO-UTP,"#N/A",Default,One per quote line,"#N/A",Annual,Advance,Quantity,Recurring,false,"#N/A","#N/A","#N/A","#N/A","#N/A","#N/A","#N/A","#N/A","#N/A",false,"#N/A",false,"#N/A",Standard,1.0,false,"#N/A",false,false,false,false,"#N/A",false,false,false,false,false,false,false,false,"#N/A",Click,false,false,false,List,"#N/A",true,"#N/A",false,"#N/A","#N/A",List,"#N/A","#N/A",Fixed Price,12.0,Renewable,"#N/A",false,"#N/A","#N/A","#N/A"
bf446e3d-451d-4c2d-91af-3712b2c85f54,"Intel E5-2695 v4 2.1GHz,45M Cache,9.60GT/s QPI,Turbo,HT,18C/36T (120W) - Designed for software defined infrastructure supercharged for efficiency, performance, and agile services delivery across cloud-native and traditional applications.","#N/A","#N/A",Hardware,true,Intel E5-2695 v4 2.1GHz,INTEL E5-2695,"#N/A",Allow Refund,One per quote line,"#N/A","#N/A","#N/A",Quantity,One-Time,true,"#N/A","#N/A","#N/A","#N/A","#N/A",Disabled,"#N/A","#N/A","#N/A",false,"#N/A",false,"#N/A","#N/A",1.0,false,"#N/A",false,false,false,false,Do Not Generate,false,false,false,false,false,false,false,false,Tabs,Click,false,false,false,List,"#N/A",true,"#N/A",false,"#N/A","#N/A",List,"#N/A","#N/A","#N/A","#N/A",One-time,"#N/A",false,"#N/A","#N/A","#N/A"
c0bcccb3-94ec-4cda-8c66-1be09aace2be,Shipping Charge Debit,"#N/A","#N/A","#N/A",true,Shipping Charge Debit,ship-debit,"#N/A",Default,One per quote line,"#N/A","#N/A","#N/A",Quantity,One-Time,true,"#N/A","#N/A","#N/A","#N/A","#N/A","#N/A","#N/A","#N/A","#N/A",false,"#N/A",false,"#N/A","#N/A",1.0,false,"#N/A",false,false,false,false,"#N/A",false,false,false,false,false,false,false,false,"#N/A",Click,false,true,false,List,"#N/A",true,"#N/A",false,"#N/A","#N/A",List,"#N/A","#N/A","#N/A","#N/A",Renewable,"#N/A",false,"#N/A","#N/A","#N/A"
c0cd8830-8604-4908-9840-e672244e6cbe,Flat Professional Service Rates for mixed-us.,"#N/A","#N/A",Services,true,Professional Service Hours (Usage),SRV-002-U,"#N/A",Default,One per quote line,"#N/A","#N/A","#N/A",Quantity,Usage,false,"#N/A","#N/A","#N/A","#N/A","#N/A","#N/A","#N/A","#N/A","#N/A",false,"#N/A",false,"#N/A","#N/A",1.0,false,"#N/A",false,false,false,false,"#N/A",false,false,false,false,false,false,true,false,"#N/A",Click,false,false,false,List,"#N/A",true,"#N/A",false,"#N/A","#N/A",List,"#N/A","#N/A","#N/A",1.0,Renewable,"#N/A",false,"#N/A","#N/A","#N/A"
c0de83ea-b309-47ff-8d8e-87a67fe80f99,"Rack PDU 20A, 120V L5-20 input 5-20 output - Basic Rack Power Distribution Unit allows users to distribute power outlets to rack-mount equipment.","#N/A","#N/A",Hardware,true,"Rack PDU 20A, 120V L5-20",PDU-2022,"#N/A",Allow Refund,One per quote line,"#N/A","#N/A","#N/A",Quantity,One-Time,true,"#N/A","#N/A","#N/A","#N/A","#N/A",Disabled,"#N/A","#N/A","#N/A",false,"#N/A",false,"#N/A","#N/A",1.0,false,"#N/A",false,false,false,false,"#N/A",false,false,false,false,true,false,false,false,Tabs,Click,false,false,false,List,"#N/A",true,"#N/A",false,"#N/A","#N/A",List,Hardware,"#N/A","#N/A","#N/A",One-time,"#N/A",false,"#N/A","#N/A","#N/A"
c2328e0c-c9b8-4543-863c-8fd28b5afd6b,"System maintenance, administration, and configuration performed by a certified technician. Also includes 24x7 phone service and monthly on-site check-ups. 20% of hardware.","#N/A","#N/A",Services,true,Gold Hardware Maintenance,SUPP-1005,"#N/A",Default,One per quote line,"#N/A",Annual,Advance,Quantity,Recurring,true,"#N/A","#N/A","#N/A","#N/A","#N/A",Disabled,"#N/A","#N/A","#N/A",false,"#N/A",false,"#N/A","#N/A",1.0,false,"#N/A",false,false,false,false,"#N/A",false,false,false,false,false,false,true,false,Tabs,Click,false,false,false,List,"#N/A",true,"#N/A",false,"#N/A","#N/A",Net,Hardware,20.0,Percent Of Total,12.0,Renewable,"#N/A",false,"#N/A","#N/A","#N/A"
c2d8b2d8-ddc9-449e-9903-a9d1638ed75b,Basic Consulting package for implementation managed by 3rd party SI/Partner on Fixed Fee basis.,"#N/A","#N/A",Services,true,Quick Start Enablement,SV-QSE,"#N/A",Default,One per quote line,"#N/A","#N/A","#N/A",Quantity,One-Time,false,"#N/A","#N/A","#N/A","#N/A","#N/A","#N/A","#N/A","#N/A","#N/A",false,"#N/A",false,"#N/A","#N/A",1.0,false,"#N/A",false,false,false,false,"#N/A",false,false,false,false,false,false,true,false,"#N/A",Click,false,false,false,List,"#N/A",true,"#N/A",false,"#N/A","#N/A",List,"#N/A","#N/A","#N/A","#N/A",Renewable,"#N/A",false,"#N/A","#N/A","#N/A"
c3686a24-e119-4d87-aa7e-cac59329d4ed,Generalist for Atomic Security Suite Deployments,"#N/A","#N/A",Services,true,Business Analyst,SRVR-002,"#N/A",Default,"#N/A","#N/A","#N/A","#N/A",Quantity,One-Time,false,"#N/A","#N/A","#N/A","#N/A","#N/A","#N/A","#N/A","#N/A","#N/A",false,"#N/A",false,"#N/A",Standard,1.0,false,"#N/A",false,false,false,false,"#N/A",false,false,false,false,false,false,false,false,"#N/A",Click,false,false,false,List,"#N/A",true,"#N/A",false,"#N/A","#N/A",List,"#N/A","#N/A","#N/A","#N/A",Renewable,"#N/A",false,"#N/A","#N/A","#N/A"
c558445c-1e6d-46c0-8ba1-7a3e1065da01,Our Solution Architects are responsible for analyzing customer requirements and designing the optimal solution capabilities.,"#N/A","#N/A",Services,true,Solutions Architect,SV-SAT,"#N/A",Default,One per quote line,"#N/A","#N/A","#N/A",Quantity,One-Time,false,"#N/A","#N/A","#N/A","#N/A","#N/A","#N/A","#N/A","#N/A","#N/A",false,"#N/A",false,"#N/A","#N/A",1.0,false,"#N/A",false,false,false,false,"#N/A",false,false,false,false,false,false,true,false,"#N/A",Click,false,false,false,List,"#N/A",true,"#N/A",false,"#N/A","#N/A",List,"#N/A","#N/A","#N/A","#N/A",Renewable,"#N/A",false,"#N/A","#N/A","#N/A"
c5f15163-db7e-4d40-abfa-8199731a9458,"Intel E5-2690 v4 2.6GHz,35M Cache,9.60GT/s 14C/28T (135W) - Designed for software defined infrastructure supercharged for efficiency, performance, and agile services delivery across cloud-native and traditional applications.","#N/A","#N/A",Hardware,true,Intel E5-2690 v4 2.6GHz,INTEL E5-2690,"#N/A",Allow Refund,One per quote line,"#N/A","#N/A","#N/A",Quantity,One-Time,true,"#N/A","#N/A","#N/A","#N/A","#N/A",Disabled,"#N/A","#N/A","#N/A",false,"#N/A",false,"#N/A","#N/A",1.0,false,"#N/A",false,false,false,false,Do Not Generate,false,false,false,false,false,false,false,false,Tabs,Click,false,false,false,List,"#N/A",true,"#N/A",false,"#N/A","#N/A",List,"#N/A","#N/A","#N/A","#N/A",One-time,"#N/A",false,"#N/A","#N/A","#N/A"
c60965b4-b0a0-4a60-8704-869a013b6c50,"The Program Director provides executive leadership, subject matter expertise, and program oversight.","#N/A","#N/A",Services,true,Program Director,SV-PD,"#N/A",Default,One per quote line,"#N/A","#N/A","#N/A",Quantity,One-Time,false,"#N/A","#N/A","#N/A","#N/A","#N/A","#N/A","#N/A","#N/A","#N/A",false,"#N/A",false,"#N/A","#N/A",1.0,false,"#N/A",false,false,false,false,"#N/A",false,false,false,false,false,false,true,false,"#N/A",Click,false,false,false,List,"#N/A",true,"#N/A",false,"#N/A","#N/A",List,"#N/A","#N/A","#N/A","#N/A",Renewable,"#N/A",false,"#N/A","#N/A","#N/A"
c64f5079-5005-4751-b96d-30117a6afe70,These accessories offer the proper cable management options to meet varying needs.,"#N/A","#N/A",Hardware,true,Cable Containment Brackets,CMPC-5884,"#N/A",Allow Refund,One per quote line,"#N/A","#N/A","#N/A",Quantity,One-Time,true,"#N/A","#N/A","#N/A","#N/A","#N/A",Disabled,"#N/A","#N/A","#N/A",false,"#N/A",false,"#N/A","#N/A",1.0,false,"#N/A",false,false,false,false,"#N/A",false,false,false,false,true,false,false,false,Tabs,Click,false,false,false,List,"#N/A",true,"#N/A",false,"#N/A","#N/A",List,Hardware,"#N/A","#N/A","#N/A",One-time,"#N/A",false,"#N/A","#N/A","#N/A"
c7442118-8d6e-4afd-87c9-affb8a809b7c,"Enterprise Security Manager is a security information and event management (SIEM) solution that delivers actionable intelligence and integrations to prioritize, investigate, and respond to threats.","#N/A","#N/A",Software,true,Enterprise Security Manager,SIEM-005,"#N/A",Default,One per quote line,"#N/A",Monthly,Arrears,Quantity,Recurring,false,"#N/A","#N/A","#N/A","#N/A","#N/A","#N/A","#N/A","#N/A","#N/A",false,"#N/A",false,"#N/A","#N/A",1.0,false,"#N/A",false,false,false,false,"#N/A",false,false,false,false,false,false,false,false,"#N/A",Click,false,false,false,List,"#N/A",true,"#N/A",false,"#N/A","#N/A",List,"#N/A","#N/A",Fixed Price,12.0,Renewable,"#N/A",false,"#N/A","#N/A","#N/A"
c8153188-67ca-4523-aa15-49ad4262f068,Windows Server Datacenter edition is designed for organizations with large workloads and heavily virtualized server environments.,"#N/A","#N/A",Software,true,Windows Server Datacenter - Onetime License,WIN SDATA-OT,"#N/A",Allow Refund,One per quote line,"#N/A","#N/A","#N/A",Quantity,One-Time,true,"#N/A","#N/A","#N/A","#N/A","#N/A",Disabled,"#N/A","#N/A","#N/A",false,"#N/A",false,"#N/A","#N/A",1.0,false,"#N/A",false,false,false,false,"#N/A",false,false,false,false,true,false,false,false,Tabs,Click,false,false,false,List,"#N/A",true,"#N/A",false,"#N/A","#N/A",List,Software,"#N/A","#N/A","#N/A",Renewable,"#N/A",false,"#N/A","#N/A","#N/A"
c8a43623-0775-40ee-8155-8b0b7b1c2e2b,"Data Normalization Experts engage early in the project and assist customers in normalizing, cleaning, and de-duping data, and can perform upload and update functions.","#N/A","#N/A",Services,true,Data Normalization Expert,SV-DNE,"#N/A",Default,One per quote line,"#N/A","#N/A","#N/A",Quantity,One-Time,true,"#N/A","#N/A","#N/A","#N/A","#N/A","#N/A","#N/A","#N/A","#N/A",false,"#N/A",false,"#N/A","#N/A",1.0,false,"#N/A",false,false,false,false,"#N/A",false,false,false,false,false,false,false,false,"#N/A",Click,false,false,false,List,"#N/A",true,"#N/A",false,"#N/A","#N/A",List,"#N/A","#N/A","#N/A","#N/A",Renewable,"#N/A",false,"#N/A","#N/A","#N/A"
cb237aa8-eec9-4604-8207-df3bcce09f93,"MaxShell cooling, power distribution, and cable management products work seamlessly with IT enclosures to provide a complete infrastructure support system.  Holds 6 rack units (U's) for a vertical storage rack.","#N/A","#N/A",Hardware,true,MaxShell 6U 600mmx870mm,BMX-1051,"#N/A",Allow Refund,One per quote line,"#N/A","#N/A","#N/A",Quantity,One-Time,true,"#N/A","#N/A","#N/A","#N/A","#N/A",Disabled,"#N/A","#N/A","#N/A",false,"#N/A",false,"#N/A","#N/A",1.0,false,"#N/A",false,false,false,false,"#N/A",false,false,false,false,true,false,false,false,Tabs,Click,false,false,false,List,"#N/A",true,"#N/A",false,"#N/A","#N/A",List,Hardware,"#N/A","#N/A","#N/A",One-time,"#N/A",false,"#N/A","#N/A","#N/A"
cce0e7fc-61e3-4bf9-8f22-a45ef8bd1de3,Data Control Manager is a best in class data protection platform that includes asset management and control.,"#N/A","#N/A",Software,true,Data Control Manager (MDQ),DP-004,"#N/A",Default,One per quote line,"#N/A",Monthly,Arrears,Quantity,Recurring,false,"#N/A",Always,"#N/A","#N/A","#N/A",Required,"#N/A","#N/A","#N/A",false,"#N/A",false,"#N/A","#N/A",1.0,false,"#N/A",false,false,false,false,"#N/A",false,false,false,false,false,false,false,false,"#N/A",Click,false,false,false,List,"#N/A",true,"#N/A",false,"#N/A","#N/A",List,"#N/A","#N/A",Fixed Price,1.0,Renewable,"#N/A",false,"#N/A","#N/A","#N/A"
cdca5bb4-3a33-4179-9ed0-009a6d1f10dd,"#N/A","#N/A","#N/A",Services,true,Quick Deploy,SRV-001,"#N/A",Default,"#N/A","#N/A",Invoice Plan,Advance,Quantity,Recurring,false,"#N/A","#N/A","#N/A","#N/A","#N/A","#N/A","#N/A","#N/A","#N/A",false,"#N/A",false,"#N/A","#N/A",1.0,false,"#N/A",false,false,false,false,"#N/A",false,false,false,false,false,false,true,false,"#N/A",Click,false,false,false,List,"#N/A",true,"#N/A",false,"#N/A","#N/A",List,"#N/A","#N/A","#N/A","#N/A",Renewable,"#N/A",false,"#N/A","#N/A","#N/A"
cdd283d9-09d4-4cb2-9dc8-d5e03d9c9d42,"Vulnerability Manager for Databases automatically discovers databases on your network, determines if the latest patches have been applied, and tests for common weaknesses.","#N/A","#N/A",Software,true,Vulnerability Manager for Databases,DBS-002,"#N/A",Default,One per quote line,"#N/A",Monthly,Arrears,Quantity,Recurring,false,"#N/A","#N/A","#N/A","#N/A","#N/A","#N/A","#N/A","#N/A","#N/A",false,"#N/A",false,"#N/A","#N/A",1.0,false,"#N/A",false,false,false,false,"#N/A",false,false,false,false,false,false,false,false,"#N/A",Click,false,false,false,List,"#N/A",true,"#N/A",false,"#N/A","#N/A",List,"#N/A","#N/A",Fixed Price,12.0,Renewable,"#N/A",false,"#N/A","#N/A","#N/A"
d324c842-ca68-47eb-9e40-2a7d3759eee7,4TB 7.2k RPM NLSAS 12Gps 3.5 in - Industry-leading rotational vibration tolerance design helps ensure consistent performance in dense multi-drive systems,"#N/A","#N/A",Hardware,true,4TB 7.2k RPM NLSAS,HD 4TB,"#N/A",Allow Refund,One per quote line,"#N/A","#N/A","#N/A",Quantity,One-Time,true,"#N/A","#N/A","#N/A","#N/A","#N/A",Disabled,"#N/A","#N/A","#N/A",false,"#N/A",false,"#N/A","#N/A",1.0,false,"#N/A",false,false,false,false,Do Not Generate,false,false,false,false,true,false,false,false,Tabs,Click,false,false,false,List,"#N/A",true,"#N/A",false,"#N/A","#N/A",List,Hardware,"#N/A","#N/A","#N/A",One-time,"#N/A",false,"#N/A","#N/A","#N/A"
d4325d69-6910-407d-9154-7fca2280c7be,"8 Hour Support SLA. Online support forums, community help documentation. Email and Online Support Tickets. Phone support during NA business hours.","#N/A","#N/A",Services,true,Gold Support,SPT-002,"#N/A",Default,"#N/A","#N/A","#N/A","#N/A",Quantity,One-Time,false,"#N/A","#N/A","#N/A","#N/A","#N/A","#N/A","#N/A","#N/A","#N/A",false,"#N/A",false,"#N/A","#N/A",1.0,false,"#N/A",false,false,false,false,"#N/A",false,false,false,false,false,false,true,false,"#N/A",Click,false,false,false,List,"#N/A",false,"#N/A",false,"#N/A","#N/A",List,"#N/A","#N/A",Fixed Price,12.0,Renewable,"#N/A",false,"#N/A","#N/A","#N/A"
d4e34809-ee4b-436f-a52d-85ab218eac0e,Quick Deploy is a flat fee basic installation package that allows hands-on organizations get a foundational deployment off the ground.,"#N/A","#N/A",Services,true,Milestone Deliverable,SRV-MST,"#N/A",Default,One per quote line,"#N/A",Invoice Plan,Advance,Quantity,Recurring,false,"#N/A","#N/A","#N/A","#N/A","#N/A","#N/A","#N/A","#N/A","#N/A",false,"#N/A",false,"#N/A","#N/A",1.0,false,"#N/A",false,false,false,false,"#N/A",false,false,false,false,false,false,true,false,"#N/A",Click,false,false,false,List,"#N/A",true,"#N/A",false,"#N/A","#N/A",List,"#N/A","#N/A","#N/A","#N/A",Renewable,"#N/A",false,"#N/A","#N/A","#N/A"
d82c0eaf-b459-4bae-ad3f-e587f5c4e578,Late Fee,"#N/A","#N/A","#N/A",true,Late Fee,late-debit,"#N/A",Default,One per quote line,"#N/A","#N/A","#N/A",Quantity,One-Time,true,"#N/A","#N/A","#N/A","#N/A","#N/A","#N/A","#N/A","#N/A","#N/A",false,"#N/A",false,"#N/A","#N/A",1.0,false,"#N/A",false,false,false,false,"#N/A",false,false,false,false,false,false,false,false,"#N/A",Click,false,true,false,List,"#N/A",true,"#N/A",false,"#N/A","#N/A",List,"#N/A","#N/A","#N/A","#N/A",Renewable,"#N/A",false,"#N/A","#N/A","#N/A"
d8423c14-6c5e-4e91-a30c-54e7ab71c7a0,"VirusScan Enterprise for Linux uses a unique, Linux-based on-access scanner that constantly monitors your system for potential attacks.","#N/A","#N/A",Software,true,VirusScan Enterprise for Linux,EP-014,"#N/A",Default,One per quote line,"#N/A",Monthly,Arrears,Quantity,Recurring,false,"#N/A","#N/A","#N/A","#N/A","#N/A","#N/A","#N/A","#N/A","#N/A",false,"#N/A",false,"#N/A",Standard,1.0,false,"#N/A",false,false,false,false,"#N/A",false,false,false,false,false,false,false,false,"#N/A",Click,false,false,false,List,"#N/A",true,"#N/A",false,"#N/A","#N/A",List,"#N/A","#N/A",Fixed Price,1.0,Renewable,"#N/A",false,"#N/A","#N/A","#N/A"
d8f34e0a-54a4-4954-b537-f84f18fd576f,"Change Control eliminates change activity in server environments that can lead to security breaches, data loss, and outages.","#N/A","#N/A",Software,true,Change Control,SS-001,"#N/A",Default,One per quote line,"#N/A",Monthly,Advance,Quantity,Recurring,false,"#N/A","#N/A","#N/A","#N/A","#N/A","#N/A","#N/A","#N/A","#N/A",false,"#N/A",false,"#N/A","#N/A",1.0,false,"#N/A",false,false,false,false,"#N/A",false,false,false,false,false,false,false,false,"#N/A",Click,false,false,false,List,"#N/A",true,"#N/A",false,"#N/A","#N/A",List,OnPremise,"#N/A","#N/A",12.0,"#N/A","#N/A",false,"#N/A","#N/A","#N/A"
da53cb01-d6f4-4132-b1e0-56d7c67d6113,Complete Threat Platform Solution is a comprehensive package that provides advanced defenses that investigate and contain zero-day threats and sophisticated attacks across multiple avenues.,"#N/A","#N/A",Software,false,Atomic Security Platform,EP-0001,"#N/A",Default,One per quote line,"#N/A",Annual,Advance,Quantity,Recurring,false,"#N/A",Always,"#N/A","#N/A","#N/A",Required,"#N/A","#N/A","#N/A",false,"#N/A",false,"#N/A","#N/A",1.0,false,"#N/A",false,false,false,false,"#N/A",true,false,false,false,false,false,true,true,"#N/A",Click,false,false,false,List,"#N/A",true,"#N/A",false,"#N/A","#N/A",List,"#N/A","#N/A",Fixed Price,1.0,Renewable,"#N/A",false,"#N/A","#N/A","#N/A"
db6286a5-1126-486e-a702-d9a60c02b55b,"Rack PDU Metered 30A, 120V L5-20 input 5-20 output - Metered Rack Power Distribution Units (PDUs) provide active metering to enable energy optimization and circuit protection.","#N/A","#N/A",Hardware,true,"Rack PDU Metered 30A, 120V L5-20",MPDU-3005,"#N/A",Allow Refund,One per quote line,"#N/A","#N/A","#N/A",Quantity,One-Time,true,"#N/A","#N/A","#N/A","#N/A","#N/A",Disabled,"#N/A","#N/A","#N/A",false,"#N/A",false,"#N/A","#N/A",1.0,false,"#N/A",false,false,false,false,"#N/A",false,false,false,false,false,false,false,false,Tabs,Click,false,false,false,List,"#N/A",true,"#N/A",false,"#N/A","#N/A",List,"#N/A","#N/A","#N/A","#N/A",One-time,"#N/A",false,"#N/A","#N/A","#N/A"
db9536b1-9393-4f7a-b3a3-87adf18408a7,Host Intrusion Prevention for Desktop safeguards your business against complex security threats that may be unintentionally introduced or allowed by desktops and laptops.,"#N/A","#N/A",Software,true,Host Intrusion Prevention for Desktop,EP-010,"#N/A",Default,One per quote line,"#N/A",Monthly,Arrears,Quantity,Recurring,false,"#N/A","#N/A","#N/A","#N/A","#N/A","#N/A","#N/A","#N/A","#N/A",false,"#N/A",false,"#N/A","#N/A",1.0,false,"#N/A",false,false,false,false,"#N/A",false,false,false,false,false,false,false,false,"#N/A",Click,false,false,false,List,"#N/A",true,"#N/A",false,"#N/A","#N/A",List,"#N/A","#N/A",Fixed Price,1.0,Renewable,"#N/A",false,"#N/A","#N/A","#N/A"
dcc37b11-de11-4f4a-ad58-9415a2737324,"Security for Email Servers provides award-winning in-memory and incremental on-demand scanning to remove viruses, worms, Trojans, phishing, and other threats from incoming and outgoing email.","#N/A","#N/A",Software,true,Security for Email Servers,AS-001,"#N/A",Default,One per quote line,"#N/A",Monthly,Arrears,Quantity,Recurring,false,"#N/A","#N/A","#N/A","#N/A","#N/A","#N/A","#N/A","#N/A","#N/A",false,"#N/A",false,"#N/A","#N/A",1.0,false,"#N/A",false,false,false,false,"#N/A",false,false,false,false,false,false,false,false,"#N/A",Click,false,false,false,List,"#N/A",true,"#N/A",false,"#N/A","#N/A",List,"#N/A","#N/A",Fixed Price,1.0,Renewable,"#N/A",false,"#N/A","#N/A","#N/A"
e3d9fed9-59b9-4855-b422-f743482dc01b,Public Cloud Server Security Suite provides instant discovery and control across Amazon Web Services (AWS) and Microsoft Azure cloud workloads.,"#N/A","#N/A",Software,true,Public Cloud Server Security Suite,SS-007,"#N/A",Default,One per quote line,"#N/A",Monthly,Arrears,Quantity,Recurring,false,"#N/A","#N/A","#N/A","#N/A","#N/A","#N/A","#N/A","#N/A","#N/A",false,"#N/A",false,"#N/A","#N/A",1.0,false,"#N/A",false,false,false,false,"#N/A",false,false,false,false,false,false,false,false,"#N/A",Click,false,false,false,List,"#N/A",true,"#N/A",false,"#N/A","#N/A",List,OnPremise,"#N/A",Fixed Price,1.0,"#N/A","#N/A",false,"#N/A","#N/A","#N/A"
e7ad652f-1c89-4ead-9012-4e7fa42661d3,"Intel Xeon E5-2643 v4 3.4GHz,20M Cache,9.60GT/s 6C/12T (135W) - Designed for software defined infrastructure supercharged for efficiency, performance, and agile services delivery across cloud-native and traditional applications.","#N/A","#N/A",Hardware,true,Intel Xeon E5-2643 v4 3.4GHz,INTEL E5-2643,"#N/A",Allow Refund,One per quote line,"#N/A","#N/A","#N/A",Quantity,One-Time,true,"#N/A","#N/A","#N/A","#N/A","#N/A",Disabled,"#N/A","#N/A","#N/A",false,"#N/A",false,"#N/A","#N/A",1.0,false,"#N/A",false,false,false,false,Do Not Generate,false,false,false,false,false,false,false,false,Tabs,Click,false,false,false,List,"#N/A",true,"#N/A",false,"#N/A","#N/A",List,"#N/A","#N/A","#N/A","#N/A",One-time,"#N/A",false,"#N/A","#N/A","#N/A"
e8076a7d-d047-46c1-8a7f-e1d96f801347,Delivers superior performance with a theretical thoughtput of 80 Gb/s bidirectional thoughput.,"#N/A","#N/A",Hardware,true,Intel X710 Dual Port 10Gb SFP,BET X710SFP,"#N/A",Allow Refund,One per quote line,"#N/A","#N/A","#N/A",Quantity,One-Time,true,"#N/A","#N/A","#N/A","#N/A","#N/A",Disabled,"#N/A","#N/A","#N/A",false,"#N/A",false,"#N/A","#N/A",1.0,false,"#N/A",false,false,false,false,Do Not Generate,false,false,false,false,true,false,false,false,Tabs,Click,false,false,false,List,"#N/A",true,"#N/A",false,"#N/A","#N/A",List,Hardware,"#N/A","#N/A","#N/A",One-time,"#N/A",false,"#N/A","#N/A","#N/A"
e91dc86a-5f2c-434c-b163-080be77616f7,"Rack PDU 30A, 120V L5-20 input 5-20 output - Basic Rack Power Distribution Unit allows users to distribute power outlets to rack-mount equipment.","#N/A","#N/A",Hardware,true,"Rack PDU 30A, 120V L5-20",PDU-2023,"#N/A",Allow Refund,One per quote line,"#N/A","#N/A","#N/A",Quantity,One-Time,true,"#N/A","#N/A","#N/A","#N/A","#N/A",Disabled,"#N/A","#N/A","#N/A",false,"#N/A",false,"#N/A","#N/A",1.0,false,"#N/A",false,false,false,false,"#N/A",false,false,false,false,true,false,false,false,Tabs,Click,false,false,false,List,"#N/A",true,"#N/A",false,"#N/A","#N/A",List,Hardware,"#N/A","#N/A","#N/A",One-time,"#N/A",false,"#N/A","#N/A","#N/A"
ea4a271e-b2f2-4db4-8f44-a0c84c8cf93b,The Power Cord is designed to provide ideal electrical connectivity to your equipments. It operates at 250-Volt voltage range.,"#N/A","#N/A",Hardware,true,C13 to C14 Power Cable 3',CMPC-5887,"#N/A",Allow Refund,One per quote line,"#N/A","#N/A","#N/A",Quantity,One-Time,true,"#N/A","#N/A","#N/A","#N/A","#N/A","#N/A","#N/A","#N/A","#N/A",false,"#N/A",false,"#N/A","#N/A",1.0,false,"#N/A",false,false,false,false,"#N/A",false,false,false,false,true,false,false,false,Tabs,Click,false,false,false,List,"#N/A",true,"#N/A",false,"#N/A","#N/A",List,Hardware,"#N/A","#N/A","#N/A",One-time,"#N/A",false,"#N/A","#N/A","#N/A"
